{
  "$schema": "https://json-schema.org/draft/2020-12/schema",
  "$id": "researcher-to-planner.schema.json",
  "type": "object",
  "additionalProperties": false,
  "required": [
    "problem_summary",
    "requirements",
    "impacted_components",
    "dependencies",
    "edge_cases",
    "risks",
    "open_questions",
    "test_scenarios"
  ],
  "properties": {
    "problem_summary": { "type": "string", "minLength": 1 },
    "requirements": { "type": "array", "items": { "type": "string" } },
    "impacted_components": { "type": "array", "items": { "type": "string" } },
    "dependencies": { "type": "array", "items": { "type": "string" } },
    "edge_cases": { "type": "array", "items": { "type": "string" } },
    "risks": { "type": "array", "items": { "type": "string" } },
    "open_questions": { "type": "array", "items": { "type": "string" } },
    "test_scenarios": { "type": "array", "items": { "type": "string" } }
  }
}
