{
  "dependencies": [
    "Google Cloud project with Gmail API enabled.",
    "OAuth consent screen and OAuth client credentials.",
    "Gmail scopes (minimum: gmail.readonly; others only if required).",
    "Pub/Sub topic/subscription and push endpoint for watch mode.",
    "Persistent datastore for trigger config/state/dedup.",
    "Encrypted secret storage for OAuth refresh tokens.",
    "HTTP client with retry, timeout, and rate-limit handling."
  ],
  "edge_cases": [
    "Expired/invalid Gmail historyId requiring controlled resync.",
    "Duplicate or out-of-order Pub/Sub notifications.",
    "Polling and watch overlap causing potential duplicate candidates.",
    "Revoked credentials or expired refresh token.",
    "High-volume mailboxes generating burst workloads.",
    "Malformed/complex MIME (nested multipart, missing text/plain, bad encodings).",
    "Large attachments exceeding configured size limits.",
    "Label updates without new message creation.",
    "Trigger disable/enable during in-flight processing.",
    "Timezone/header date inconsistencies vs internalDate ordering."
  ],
  "impacted_components": [
    "Trigger runtime and node registry.",
    "Credential/secrets management subsystem.",
    "Google OAuth2 integration module.",
    "Gmail API client adapter (watch/history/messages/attachments).",
    "Scheduler/background workers for polling and watch-renewal.",
    "Pub/Sub webhook/receiver path (if watch mode enabled).",
    "State persistence for checkpoints/dedup/dead-letter records.",
    "Payload normalization/mapping utilities.",
    "API/UI/DSL config schema and validation layer.",
    "Logging, metrics, and alerting pipeline."
  ],
  "open_questions": [
    "For v1, should activation process only new emails or allow optional historical backfill?",
    "Is watch+Pub/Sub mandatory for v1, or is polling-only acceptable initially?",
    "What exact parity with n8n is required (fields, filters, defaults, behavior)?",
    "What attachment size/content limits are acceptable for v1?",
    "What delivery guarantees are required (at-least-once vs effectively-once target)?",
    "What SLA is expected for trigger latency and recovery from transient failures?",
    "Is tenant/domain-wide delegation required, or only per-user OAuth?",
    "Which failure modes should auto-pause vs continue retrying?"
  ],
  "problem_summary": "Implement a Gmail Trigger node with n8n-like behavior: connect via Google OAuth2, detect new emails (watch/poll), and emit normalized workflow events reliably and securely.",
  "requirements": [
    "Support Google OAuth2 (offline access) with encrypted token storage and automatic token refresh.",
    "Provide trigger modes: Gmail watch (Pub/Sub) and polling fallback, with configurable mode selection.",
    "Allow mailbox/filter options (labels, inbox/all mail, from/to/subject/query, unread-only, include spam/trash).",
    "Emit a stable payload schema including message/thread IDs, headers, snippet, body parts, labels, internal date, and attachment metadata/content per policy.",
    "Implement deduplication and checkpointing (historyId/cursor) to prevent duplicate emissions across retries/restarts.",
    "Support attachment handling policies (metadata-only vs download) with max size limits and streaming-safe retrieval.",
    "Add robust retry/backoff for 429/5xx/network errors plus dead-letter/error-state handling for non-retriable failures.",
    "Expose configuration in node schema/UI/DSL with strong validation, defaults, and actionable error messages.",
    "Add observability: trigger health/status, checkpoint visibility, watch renewal status, and quota/error metrics.",
    "Document setup and behavior (OAuth setup, scopes, watch vs poll semantics, backfill behavior)."
  ],
  "risks": [
    "Missed or duplicate events due to incorrect checkpoint/dedup design.",
    "Quota exhaustion from aggressive polling or inefficient hydration.",
    "Security exposure if tokens or sensitive email data are logged/stored improperly.",
    "Operational complexity and support burden for watch + Pub/Sub setup.",
    "Payload contract drift causing downstream workflow breakage.",
    "Increased latency or backlog under burst traffic without backpressure controls."
  ],
  "test_scenarios": [
    "Create trigger with valid OAuth and receive one event for a new matching email.",
    "Send rapid consecutive emails and verify no duplicate emissions.",
    "Apply label/query filters and verify only matching emails trigger.",
    "Restart worker/service and verify checkpoint prevents reprocessing.",
    "Force access-token expiry and verify automatic refresh succeeds.",
    "Revoke OAuth grant and verify trigger transitions to clear error/paused state.",
    "Inject Gmail 429/5xx/network faults and verify exponential backoff/retry behavior.",
    "Process multipart email with attachments and verify normalized payload correctness.",
    "Test oversized attachments and malformed MIME for graceful policy-compliant handling.",
    "Simulate invalid historyId and verify resync path restores processing.",
    "Disable then re-enable trigger and verify configured backfill/no-backfill semantics.",
    "In watch mode, replay duplicate/out-of-order notifications and verify idempotent output."
  ]
}
